{
  "schema_version": "1.0",
  "event_id": "01JFIX0001PERMEXP0001",
  "idempotency_key": "idem-permexp-1",
  "space_id": "teamem-poc",
  "timestamp": "2026-05-03T16:00:30.000Z",
  "principal": "bob",
  "actor": "claude-code/session-1",
  "delegation": "bob->claude-code",
  "event_type": "permission_expired",
  "scope": {},
  "payload": {
    "req_id": "01JFIX0001PERMREQ0000001"
  }
}
